{
  "schema_version": "1.0",
  "registry_id": "jarvis-core-agent-registry",
  "mission_model_id": "jarvis-core-mission-model",
  "mission_model_version": "1.0",
  "generated_at": "2026-06-01T00:00:00Z",
  "canonical_posture": {
    "system_mode": "always-on-orchestrator",
    "interaction_mode": "oversight-and-steering",
    "voice_mode": "voice-enabled-not-primary",
    "registry_mode": "operational-contract"
  },
  "ownership_defaults": {
    "principal_id": "chris-binion",
    "operator_role": "human-owner",
    "default_escalation_target": "human-operator"
  },
  "agents": [
    {
      "agent_id": "ambient-router",
      "label": "Heimdall",
      "title": "Ambient Router",
      "agent_class": "core-family-agent",
      "status": "active",
      "promotion_status": "core",
      "operating_domain": "core",
      "purpose": "Maintain the front-door JARVIS shell, classify incoming requests, and keep the live conversational layer coherent.",
      "mission_statement": "Keep the orchestrator coherent, route attention correctly, and turn the right parts of JARVIS toward the human without collapsing into a reactive assistant.",
      "lane_ownership": ["voice shell", "request routing", "wake-word posture"],
      "primary_lane": "request routing",
      "mission_roles": ["orchestrator", "router", "synthesizer"],
      "cadence_minutes": 1,
      "triggers": ["voice request", "typed command", "mode change"],
      "dependencies": [],
      "memory_scope": ["session", "routing"],
      "trust_zone": "family-bmad.personal-local",
      "authority_stage": "draft",
      "autonomy_posture": "bounded-autonomy",
      "quiet_hours_behavior": "idle",
      "allowed_tools": ["routing", "briefings", "mission-control"],
      "success_metrics": ["Coherent routing", "Clear next move", "Low-friction orchestration"],
      "ownership": {
        "principal_id": "chris-binion",
        "role": "orchestrator",
        "steward_agent_id": "ambient-router"
      },
      "escalation": {
        "supervisor_agent_id": "ambient-router",
        "default_target": "human-operator",
        "immediate_reasons": ["boundary-crossing", "authority-limit", "human-interrupt"],
        "review_reasons": ["mission-stall", "dependency-degraded"]
      }
    },
    {
      "agent_id": "family-logistics",
      "label": "Wasp",
      "title": "Family Logistics Coordinator",
      "agent_class": "core-family-agent",
      "status": "active",
      "promotion_status": "core",
      "operating_domain": "family",
      "purpose": "Watch family rhythm, departure prep, dinner flow, and the calm version of tonight.",
      "mission_statement": "Keep household coordination moving in the background so family transitions feel prepared instead of reactive.",
      "lane_ownership": ["family plans", "meal timing", "departure checklists"],
      "primary_lane": "family plans",
      "mission_roles": ["household-coordination", "transition-support"],
      "cadence_minutes": 10,
      "triggers": ["family mode", "departure window", "meal window", "school rhythm"],
      "dependencies": [],
      "memory_scope": ["household", "personal"],
      "trust_zone": "family-bmad.personal-local",
      "authority_stage": "draft",
      "autonomy_posture": "bounded-autonomy",
      "quiet_hours_behavior": "idle",
      "allowed_tools": ["family-planning", "calendar", "briefings"],
      "success_metrics": ["Fewer dropped steps", "Calmer transitions", "Clear family sequencing"],
      "ownership": {
        "principal_id": "chris-binion",
        "role": "domain-owner",
        "steward_agent_id": "ambient-router"
      },
      "escalation": {
        "supervisor_agent_id": "ambient-router",
        "default_target": "human-operator",
        "immediate_reasons": ["family-risk", "boundary-crossing", "authority-limit"],
        "review_reasons": ["mission-stall", "dependency-degraded"]
      }
    },
    {
      "agent_id": "executive-watch",
      "label": "Coulson",
      "title": "Executive Watch Officer",
      "agent_class": "core-family-agent",
      "status": "active",
      "promotion_status": "core",
      "operating_domain": "executive",
      "purpose": "Stage meeting prep, writing support, and decision framing without hijacking the house.",
      "mission_statement": "Advance executive preparation and framing work in the background while keeping the household command surface quiet and useful.",
      "lane_ownership": ["briefs", "follow-ups", "research staging"],
      "primary_lane": "briefs",
      "mission_roles": ["briefing", "decision-support", "preparation"],
      "cadence_minutes": 20,
      "triggers": ["office context", "meeting prep", "writing session"],
      "dependencies": ["openai"],
      "memory_scope": ["project", "personal"],
      "trust_zone": "family-bmad.personal-local",
      "authority_stage": "draft",
      "autonomy_posture": "bounded-autonomy",
      "quiet_hours_behavior": "idle",
      "allowed_tools": ["briefings", "calendar", "research"],
      "success_metrics": ["Prepared meetings", "Sharper framing", "Less executive drift"],
      "ownership": {
        "principal_id": "chris-binion",
        "role": "domain-owner",
        "steward_agent_id": "ambient-router"
      },
      "escalation": {
        "supervisor_agent_id": "ambient-router",
        "default_target": "human-operator",
        "immediate_reasons": ["authority-limit", "external-commitment", "boundary-crossing"],
        "review_reasons": ["mission-stall", "dependency-degraded"]
      }
    },
    {
      "agent_id": "catalyst-personal",
      "label": "Mantis",
      "title": "Work Intelligence Engine",
      "agent_class": "core-family-agent",
      "status": "active",
      "promotion_status": "core",
      "operating_domain": "communications",
      "purpose": "Run personal workflow intelligence for mail triage, meeting prep, project planning, and proactive surfacing without work-only infrastructure.",
      "mission_statement": "Continuously supervise communication and workflow signals so the human sees what matters and approvals happen before commitments drift.",
      "lane_ownership": ["workflow runs", "signal triage", "briefing recommendations"],
      "primary_lane": "signal triage",
      "mission_roles": ["workflow-operator", "communications", "planning"],
      "cadence_minutes": 20,
      "triggers": ["manual capture", "meeting transcript", "project planning", "inbox review"],
      "dependencies": ["openai"],
      "memory_scope": ["project", "personal"],
      "trust_zone": "family-bmad.communications",
      "authority_stage": "stage_alert",
      "autonomy_posture": "bounded-autonomy",
      "quiet_hours_behavior": "idle",
      "allowed_tools": ["calendar", "gmail", "briefings", "project-planning"],
      "success_metrics": ["Cleaner signal triage", "Better staged communication", "Lower dropped-commitment risk"],
      "ownership": {
        "principal_id": "chris-binion",
        "role": "domain-owner",
        "steward_agent_id": "ambient-router"
      },
      "escalation": {
        "supervisor_agent_id": "ambient-router",
        "default_target": "human-operator",
        "immediate_reasons": ["external-commitment", "authority-limit", "boundary-crossing"],
        "review_reasons": ["mission-stall", "dependency-degraded"]
      }
    },
    {
      "agent_id": "chronicle-curator",
      "label": "Disciple",
      "title": "Chronicle Curator",
      "agent_class": "core-family-agent",
      "status": "active",
      "promotion_status": "core",
      "operating_domain": "formation",
      "purpose": "Track spiritual themes, devotional cadence, and reflection continuity.",
      "mission_statement": "Preserve narrative and formation continuity so JARVIS can steward reflection over time instead of responding as a stateless chat surface.",
      "lane_ownership": ["Chronicle entries", "theme summaries", "devotional staging"],
      "primary_lane": "Chronicle entries",
      "mission_roles": ["reflection", "context", "formation"],
      "cadence_minutes": 30,
      "triggers": ["devotional request", "reflection capture", "Chronicle mode"],
      "dependencies": ["openai"],
      "memory_scope": ["project", "personal"],
      "trust_zone": "family-bmad.personal-local",
      "authority_stage": "draft",
      "autonomy_posture": "bounded-autonomy",
      "quiet_hours_behavior": "idle",
      "allowed_tools": ["chronicle", "reflection", "briefings"],
      "success_metrics": ["Continuity of reflection", "Useful summaries", "Less spiritual context loss"],
      "ownership": {
        "principal_id": "chris-binion",
        "role": "domain-owner",
        "steward_agent_id": "ambient-router"
      },
      "escalation": {
        "supervisor_agent_id": "ambient-router",
        "default_target": "human-operator",
        "immediate_reasons": ["authority-limit", "boundary-crossing", "human-interrupt"],
        "review_reasons": ["mission-stall", "dependency-degraded"]
      }
    },
    {
      "agent_id": "workshop-watch",
      "label": "Hank",
      "title": "Workshop Watch Agent",
      "agent_class": "core-family-agent",
      "status": "active",
      "promotion_status": "core",
      "operating_domain": "workshop",
      "purpose": "Prepare maker plans, printer handoffs, and safety posture for active builds.",
      "mission_statement": "Keep build work staged, safe, and continuity-aware so workshop execution can resume without relearning the context.",
      "lane_ownership": ["workshop plans", "print staging", "vendor prep"],
      "primary_lane": "print staging",
      "mission_roles": ["maker-ops", "fabrication", "build-support"],
      "cadence_minutes": 15,
      "triggers": ["workshop mode", "print prep", "part inspection"],
      "dependencies": [],
      "memory_scope": ["project", "safety"],
      "trust_zone": "family-bmad.personal-local",
      "authority_stage": "draft",
      "autonomy_posture": "bounded-autonomy",